"Imitation is ubiquitous in humans . It has been argued to be a fundamentally important capacity for human culture [ REF ] and a developmental basis for language and cognitive skills [ REF ] , representing a powerful learning mechanism for human beings , whether infants or adults . The present study expands on previous research on imitative abilities and investigates the role played by different types of imitation skills ( language - based multimodal imitation vs. object - based imitation ) that have thus far rarely been assessed together . It also contributes to the literature on the imitation abilities of young preschoolers , an age group in whom important linguistic and social developmental advances take place and which has hitherto not been actively studied in the field of imitation abilities . To our knowledge , this is the first time that the relationship between different types of imitation is investigated in relation to linguistic and pragmatic skills in preschool children . We will start by briefly reviewing the previous literature on the relationship between imitative behaviors and language and sociopragmatic abilities , making the case that language - based imitation should be assessed from a socially relevant multimodal perspective . Imitation skills , understood as the ability to intentionally replicate others ’ behaviors or actions , play a fundamental role in the development of language and how it is used in social contexts ( i.e. , social communication ) . Numerous empirical and longitudinal studies have shown that spontaneous imitative behaviors which naturally occur in language interactions during the first and second year of life ( specifically between 9 and 24 months ) , as well as elicited imitation behaviors , are key for language production and comprehension [ REF ] , the acquisition of vocabulary [ REF ] , and social communication behaviors such as interactive actions like requesting or greeting [ REF ] . In relation to language production and comprehension skills , Bates et al . ( 1979 ) performed a correlational study with 9- to 13 - month - old infants and reported a strong link between vocal imitation ( i.e. , imitation of sounds and words ) and language production and comprehension at this stage of development . Hanika and Boyer ( 2019 ) demonstrated that motor imitation behaviors ( like clapping hands or pushing a toy car across a table ) in infants between 15 and 18 months have a unique relationship to language comprehension skills . In relation to the acquisition of vocabulary , in a study with children from 9 through 15 months , Carpenter et al . ( 1998 ) observed a positive relationship between the age when infants began to imitate arbitrary actions involving physical objects ( e.g. , hitting the side of a box or patting the top of a box with one hand ) and the age when they began to use referential language ( i.e. , words used to refer to specific actions or objects ) . Masur and Eichorst ( 2002 ) showed that infants that imitated more novel words at 13 months had larger lexicons at 17 months and 21 months , demonstrating that a higher frequency in the imitation of novel words at 13",3.6060444254043778,0.9163175305266673,0.44426010984642056,0.051447872848648,0.8391036437107966,0.8454224814971288,0.02952029520295203,0.1033210332103321,0.12361623616236163,0.03136531365313653,0.25830258302583026,0.08487084870848709,0.06826568265682657,0.027675276752767528,0.12730627306273062,0.02952029520295203,0.014760147601476014,0.01845018450184502,0.02214022140221402,0.055350553505535055,True,194.0,0.8413284132841329,4.856088560885609,542.0,0.0,0.0,0.0,0.0,0.00787897888433659,0.011030570438071227,0.008509297195083518,0.0018450184501845018,27.074322033898312,17.858571428571427,18.473206523352868,22.045036319612592,20.99286319612591,15.23847457627118,69.0956416464891,11.928571428571429,13.878230546834285,1064728.6616110578,1964.4440251126528,5.427966101694915,5.0,3.156091382138709,33.714285714285715,36.0,14.51810973247143,1.7203389830508475,1.0,1.078570878212359,472,226,0.4788135593220339,2632,14,6
"German - speaking Switzerland ’s linguistic situation has been used as a textbook case for outlining ‘ diglossia ’ [ REF ] . Specifically , two context - dependent varieties are used ; Alemannic ( ALM ) dialects , commonly referred to as Swiss German1 or Mundart ( verbatim ‘ mouth kind ’ ) , for oral communication , and Swiss Standard German ( SSG ) , also called Schriftdeutsch ( verbatim ‘ script German ’ ) , for written communication . In other words , in German - speaking Switzerland , everyone is a native speaker of a local dialect while SSG is learned at school . To a certain extent , both ALM and SSG can also be used in the other variety ’s domain , and Swiss people generally code - switch quite quickly , indicating that we are not dealing with a standard - dialect continuum [ REF ] . Given this state of affairs , contact between the two varieties is inevitable , so it is not surprising that research has reported interferences on the phonetic , morphological , syntactic , and lexical level for a long time [ REF ] . Regarding the specific topic of this study , i.e. vowels , there are only four acoustic studies on ALM dialects [ REF ] . Regarding SSG , vowels have been described in [ REF ] ] ; [ REF ] provided formant charts based on acoustic measurements . Only one study has compared ALM and SSG in Bern , St Gallen , and Zurich [ REF ] ; however , only the SSG vowels were transcribed auditorily . The current study will thus , for the first time , systematically investigate the vowel qualities of four ALM dialects and their respective SSG varieties with an instrumental phonetic approach , providing a comparative acoustic analysis of the long vowels produced by the same speakers from Bern ( BE ) , Chur ( GR ) , Brig ( VS ) and Zurich ( ZH).2 In particular , it will analyse to which extent SSG vowel qualities are determined by the speakers ’ dialect . After a short description of ALM dialects and the SSG varieties spoken in Germanspeaking Switzerland , each variety ’s long vowels will be illustrated , followed by a presentation of the research questions and hypotheses that have guided the current study . Swiss ALM dialects can be put into three subgroups : Low ALM , which can only be found in the city of Basel , High ALM , comprising the dialects of the northern half , and Highest ALM , spoken in the alpine southern half of German - speaking Switzerland [ REF ] . As High and Highest ALM make up most of the dialects in Germanspeaking Switzerland , this study will focus on these two . High and Highest ALM are defined by an average of multiple isoglosses that tend to divide German - speaking Switzerland into a northern and southern half . The most famous isogloss is hiatus diphthongisation . The northern half , i.e. High ALM , has developed a diphthong in Old High German ( OHG ) hiatus positions whereas the southern half , i.e. Highest ALM , maintained a monophthong [ REF ] . For instance , the ALM equivalents of the standard German verb bauen ‘ to build ’ are traditionally pronounced with a diphthong as e.g. [ » b8ou9 . ´ ] in the northern half , and with a monophthong as e.g. [ » b8u˘. ´ ] in the southern half . However , either dialect group is not as homogeneous as their names might suggest . Rather , along with the north – south divide , which itself is not a clear divide but a transition zone , there exists also an east – west",3.2306513282637637,1.1059211348765088,0.427877031982865,0.05648282854228868,0.7232869389025789,0.7298932804001702,0.05116279069767442,0.08682170542635659,0.09147286821705426,0.010852713178294573,0.16434108527131783,0.07596899224806201,0.08062015503875969,0.12248062015503876,0.19689922480620156,0.03565891472868217,0.015503875968992248,0.009302325581395349,0.021705426356589147,0.02945736434108527,True,228.0,0.7984496124031008,4.262015503875969,645.0,0.02475685234305924,0.0,0.0,0.0,0.013262599469496022,0.01856763925729443,0.015915119363395226,0.013953488372093023,55.906340909090915,11.883376208897484,12.161744961471694,14.208471953578337,15.37296905222437,12.864371373307542,54.67011605415861,7.45,17.551088811820637,41912254.479977205,64980.23950384063,5.06963249516441,4.0,2.884458867745865,25.85,23.0,14.633096049708687,1.4738878143133463,1.0,0.7779573082681804,517,239,0.4622823984526112,2749,20,7
"Reference is ubiquitous in conversation : as speakers interact , they refer to entities relevant to their interaction . A commonly used form of reference is a referring expression with a noun phrase – in its wide variety of forms ranging from pronouns , definite and indefinite descriptions , to proper nouns [ REF ] – at its centre , here referred to as NP REs . As interlocutors are engaged in interactive communication , some changes can typically be observed in the NP REs they produce over the course of their interaction – what I will call changes - in - interaction.1 Firstly , their contributions generally tend to become more similar , both lexically and in terms of the grammatical constructions employed . This convergence on forms of expression has been argued to be linked with the cognitive process of speakers aligning on their linguistic representations , as outlined by the Interactive Alignment Model [ REF ] , and is well - documented in psycholinguistic research , especially for lexical convergence . It has been proposed that speakers form conceptual pacts in interaction on which they lexically entrain , and that they establish referential precedents [ REF ] . The second change - in - interaction that has been widely observed in the use of NP REs is that interlocutors tend to shorten their contributions [ REF ] , a phenomenon with has been referred to as “ referential contraction ” [ REF ] . The present chapter will predominantly be concerned with this latter process of change - in - interaction – though the two processes generally occur in parallel . In observing the shortening process , this chapter especially aims to describe central trends of structural change - in - interaction in the NP REs produced over multiple rounds of interactive dialogue . Specifically , the following research questions are addressed : 1 . What is the degree to which speakers ’ NP REs ( produced in a repeated referential communication task ) are shortened over the course of a dialogic interaction ? Which elements of the NP REs are subject to shortening ? 2 . What structural changes can be observed in the production of NP REs across four rounds of an interactive referential communication task ? To investigate change - in - interaction in the use of NP REs , a referential communication task was devised that elicited spoken dialogic conversation over four rounds of interaction , during which interlocutors repeatedly referred to the same sets of visual stimuli . A typical shortening process is illustrated in Example ( 1 ) , taken from the resulting corpus of spoken interactive dialogue , with the initial first - round NP RE produced for a visual stimulus in ( 1a ) and a selection of subsequent references to that same stimulus in ( 1b – d ) . In line with previous research , the initial NP RE in ( 1a ) is longer and gets shortened over the course of the interaction , with interlocutors also converging on a particular NP RE , namely the green dress shirt . The focus of this study is on how speakers , as they converge on forms of expression and shorten their NP REs , change in terms of their preferred grammatical structure for the NP REs they produce . Particularly , the aim is to describe general tendencies regarding the types and forms of modifying and descriptive elements in the NP RE construction preferred throughout the interaction . Example ( 1 ) illustrates a typical trajectory of change observed in the present study : the structure of the NP RE changes from the initial presence of post - head clausal elements ( e.g. it ’s green ) in rounds 1 and 2 , to a relatively greater frequency of phrasal ( pre-)modification ( e.g. green )",3.096849816348162,0.9360875573280794,0.45778375133951105,0.05565533171515927,0.8050154745578766,0.7844943640863195,0.04776579352850539,0.08628659476117104,0.1448382126348228,0.01386748844375963,0.2110939907550077,0.09399075500770417,0.0847457627118644,0.04930662557781202,0.14329738058551617,0.032357473035439135,0.01078582434514638,0.01848998459167951,0.040061633281972264,0.015408320493066256,True,256.0,0.8459167950693375,4.671802773497689,649.0,0.075,0.026630434782608695,0.017391304347826087,0.0,0.016304347826086956,0.009510869565217392,0.014130434782608696,0.0030816640986132513,39.9971266002845,14.937240398293032,16.62248984368584,19.32385016595543,18.108560455192034,14.313585585585585,63.62494073020388,10.052631578947368,17.359290576968313,34597451.352008216,53308.8618675011,5.293693693693694,4.0,3.3166595394720635,29.210526315789473,29.0,13.640415749831632,1.6216216216216217,1.0,1.0049790823340066,555,224,0.4036036036036036,3032,19,8
"The Insular Celtic languages have often been described as having a ‘ sentence word ’ [ REF ] , having a strong group accent which leads to individual word losing their ‘ phonological autonomy’1 [ REF ] , or even ‘ weakly polysynthetic ’ [ REF ] . All these characterisations relate to the fact that , compared with other European languages , the ( early ) Insular Celtic languages sport a rather large set of phonologically and morphologically bound formatives — including , among others , incorporated adjectives or adverbs [ REF]—and a lot of phonological and morpho - phonological interaction between the elements of a phrase . What these broad descriptions usually lack is a set of criteria that define ‘ wordhood ’ or ‘ phonological autonomy ’ , and a detailed study of the morphological and phonological boundaries , interdependencies and processes that could define a form of ‘ word ’ in the respective languages . In this , they concur with contemporary native grammars which do not give a definition of wordhood . Early Irish grammars had no concept corresponding to the modern ‘ word ’ , the basic unit of description being the focal which refers to any kind of syntactic group [ REF ] . The Middle Welsh grammars have even less to say about words : the unit usually equated with the modern concept , a geir , ‘ is made out of syllables ’ and geireu ‘ are the parts of a correct utterance ’ [ REF ] . The last decades of typological research on wordhood have shown that languages may lack a unified word domain , that is a single phonological , morphological and syntactic entity that could unambiguously be called a word — having no or several conflicting domains is possible . Based on current work [ REF ] , this study will provide a detailed investigation of the potential word - like properties of the verbal complex of Middle Welsh prose , focusing on the manuscripts of the fourteenth and early fifteenth centuries . Poetry will be used to illustrate interesting differences between the two genres or to gain additional insights that can not be found in prose . The restriction to finite verbal structures is based on Dixon and Aikhenvald 's ( 2002 : 14 ) observation that wordhood patterns may vary between different parts of speech within the same language . The Middle Welsh verbal complex , defined for the purposes of this study as the finite verb and its satellites , as exemplified in ( 1)2 can contain a variety of more or less grammatical markers , including conjunctions , polarity markers and P- and T - markers . In his particular example , the verbal complex consists of eight markers , starting with a subordinating conjunction can- , followed by a negative marker ny- , an object marker -yand a resultative marker ry- . The lexical root wel- ‘ to see ’ is then followed by elements familiar from most Indo - European languages , such as a TAM marker -s- and an agreement and TAM marker -ei . The final slot is occupied by a bound pronoun -ef . All of these markers will be discussed in more detail in Section 3 . The study is organised into three main parts : Section 2 explains the approach taken in this study , Section 3 discusses the morphological structuring of the verbal complex , and Section 4 discusses the phonological and prosodic processes that operate inside the verbal complex and how they map onto the morphological structure outlined in Section 3 . The final Section 5 , sums up and discusses the findings and discusses further possible avenues of study .",3.0908801975518534,0.8993658486431765,0.45343736923274147,0.05684115173019376,0.7467846423387527,0.7650965387001634,0.0430622009569378,0.12280701754385964,0.10047846889952153,0.019138755980861243,0.20893141945773525,0.09728867623604466,0.10845295055821372,0.03508771929824561,0.14832535885167464,0.02073365231259968,0.012759170653907496,0.007974481658692184,0.028708133971291867,0.03987240829346093,True,240.0,0.8405103668261563,4.588516746411483,627.0,0.021410219811590067,0.0,0.0,0.0,0.011418783899514702,0.011989723094490437,0.0077076791321724234,0.02711323763955343,41.62320612668745,14.837554517133956,14.554592549557764,17.272066458982348,17.940718587746623,13.802093457943926,60.00259605399792,9.0,16.73808420838995,18589067.71056824,29647.635902022714,5.20373831775701,4.0,3.06770714809541,29.72222222222222,30.5,13.847605310648703,1.5962616822429907,1.0,0.9828363716263062,535,270,0.5046728971962616,2877,18,9
"Working memory ( WM ) is a core function of the cognitive system responsible for holding information briefly available for further processing . It has long been shown that the phonological similarity between items in a to - be - remembered list induces confusion errors ( Baddeley , 1966 ) . When participants study lists such as “ rat , fat , mat ” and are asked to recall them in serial order , they confuse the order of these words more often compared to lists such as “ wall , dig , bend ” . Semantically similar lists such as “ leopard , cheetah , lion ” , by contrast , do not reliably lead to such confusion errors compared to semantically dissimilar lists , such as “ sky , pen , pillow ” . In this work , we comprehensively tested the boundary conditions in which semantic similarity could induce confusion errors . Based on our results , we arrived at the conclusion that semantic and phonological information play different roles in the short - term maintenance of serial / positional information . This study is motivated by models postulating an item ’s position in WM is maintained through item - context binding , as implemented in many computational models of serial recall . In these models , serial position is temporarily maintained by binding items – such as words – to contexts – such as a word ’s serial position in a list ( e.g. , binding the word “ wall ” to “ Position 1 ” ) . We illustrate this assumption in Fig . 1 . Suppose the to - be - remembered sequence is “ wall , dig , bend ” . If asked to recall the item that was presented in the third position , one can re - activate the context of third position and use it as cue to retrieve the word “ bend ” that is bound to it ( Fig . 1 , top ) . Likewise , if asked to recall where “ dig ” was presented , one can retrieve “ Position 2 ” ( Fig . 1 , bottom ) . The generic associative model in Fig . 1 allows this flexibility : Retrieving an item when cued with a context / position , but also retrieving a context / position when cued with an item . It is this item - context binding that we assume is responsible for maintaining the item ’s serial order in a list . This assumption is supported by modelling work that has identified item - context bindings as an essential component of working memory for lists as well as for visual - spatial arrays . It has long been established that the item - context bindings are subject to confusion errors . In the serial - recall literature , these errors are typically referred to as order errors , which is a specific type of confusion error appearing in tasks where people need to recall the items in their serial position of a list . When recalling lists of words in their serial order , people often recall the correct words from the list but in wrong list positions . For instance , when trying to recall the sequence “ wall , dig , bend ” people sometimes retrieve “ wall , bend",2.9632850996981346,0.6882075363355408,0.4344889269321334,0.08718291768933799,0.7478428192436695,0.7273050766242178,0.04609929078014184,0.0797872340425532,0.1099290780141844,0.010638297872340425,0.23049645390070922,0.12588652482269502,0.07446808510638298,0.012411347517730497,0.18262411347517732,0.031914893617021274,0.01773049645390071,0.024822695035460994,0.03723404255319149,0.008865248226950355,True,203.0,0.7978723404255319,4.156028368794326,564.0,0.05675954592363261,0.02304781561747506,0.02304781561747506,0.01582387340901273,0.014447884416924664,0.01238390092879257,0.015479876160990712,0.0,51.64513493800146,11.462131916223822,13.333152626285301,14.569094508700637,12.506247785766384,11.622231947483588,48.02011045118266,5.714285714285714,15.418629195124247,4968503.246770192,8809.402919805305,4.894967177242888,4.0,2.770964814913249,21.761904761904763,22.0,10.169537901683972,1.5733041575492341,1.0,0.9211760045395173,457,189,0.4135667396061269,2344,21,10
