"Murners Übersetzung der ' Aeneis ' ist ein bedeutendes Werk im deutschen Humanismus , da es die erste deutsche Übersetzung eines antiken Klassikers ist . Um die Übersetzungspraxis von Murner besser zu verstehen , werden zunächst die Untersuchungsergebnisse seiner lateinischen Vorlage vorgestellt . Dabei wird deutlich , dass Murner nicht nur eine wortgetreue Übersetzung anstrebt , sondern auch eine didaktische Intention verfolgt . Er versucht , den deutschen Lesern einen Gesamttext zu präsentieren , der in ihrer Sprache verständlich ist . Dieser Ansatz zeigt , dass Murner nicht nur als Übersetzer , sondern auch als Vermittler antiker Literatur fungiert . Durch seine Übersetzung erhält die ' Aeneis ' eine Renaissance im deutschen Sprachraum , da sie nun einem breiteren Publikum zugänglich ist . Die Bedeutung von Murners Übersetzung liegt daher nicht nur in ihrer sprachlichen Leistung , sondern auch in ihrer Funktion als Vermittlerin antiker Literatur . Durch seine Bemühungen wird die ' Aeneis ' einem breiteren Publikum im deutschen Sprachraum zugänglich gemacht und erfährt somit eine Renaissance . Murners Übersetzung zeugt von seinem Bestreben , nicht nur den Inhalt des Originals wiederzugeben , sondern auch die Sprache und den Stil an das deutsche Publikum anzupassen . Es wird deutlich , dass Murner eine didaktische Intention verfolgt , indem er den deutschen Lesern einen Gesamttext präsentiert , der in ihrer Sprache verständlich ist . Diese Übersetzungspraxis hebt Murner von anderen Übersetzern antiker Klassiker im deutschen Humanismus ab und macht seine Übersetzung zu einem bedeutenden Werk . Die vorliegende Studie untersucht daher Murners Übersetzungspraxis genauer und zeigt auf , wie er die Herausforderungen der Übertragung von Vergils ' Aeneis ' ins Deutsche bewältigt hat . Durch eine detaillierte Analyse der Übersetzungstechniken und -strategien wird ein Einblick in Murners Arbeitsweise gewährt und seine Leistung als Übersetzer gewürdigt . Diese Studie befasst sich mit der Übersetzungspraxis von Thomas Murner und untersucht , wie er die Herausforderungen der Übertragung von Vergils ' Aeneis ' ins Deutsche bewältigt hat . Dabei wird eine detaillierte Analyse der von Murner verwendeten Übersetzungstechniken und -strategien durchgeführt , um einen Einblick in seine Arbeitsweise als Übersetzer zu gewinnen . Es wird deutlich , dass Murner nicht nur den Inhalt des Originals wiedergeben möchte , sondern auch die Sprache und den Stil an das deutsche Publikum anpasst . Diese besondere Herangehensweise hebt Murner von anderen Übersetzern antiker Klassiker im deutschen Humanismus ab und macht seine Übersetzung zu einem bedeutenden Werk . Durch die Vermittlung der ' Aeneis ' an ein breiteres Publikum im deutschen Sprachraum erhält das antike Epos eine Renaissance und wird somit weiterhin in der deutschen Literaturgeschichte präsent sein . Diese Studie befasst sich mit der Übersetzungspraxis von Thomas Murner und untersucht , wie er die Herausforderungen der Übertragung von Vergils ' Aeneis ' ins Deutsche bewältigt hat . Dabei wird eine detaillierte Analyse der von Murner verwendeten Übersetzungstechniken und -strategien durchgeführt , um einen Einblick in seine Arbeitsweise als Übersetzer zu gewinnen . Es wird deutlich , dass Murner nicht nur den Inhalt des Originals wiedergeben möchte , sondern auch die Sprache und den Stil an das deutsche Publikum anpasst . Diese besondere Herangehensweise hebt Murner von anderen Übersetzern antiker Klassiker im deutschen Humanismus ab und macht seine Übersetzung zu einem bedeutenden Werk . Durch die Vermittlung der ' Aeneis ' an ein breiteres Publikum im deutschen Sprachraum erhält das antike Epos eine Renaissance und wird somit weiterhin in der deutschen Literaturgeschichte präsent sein .",3.662468312241643,0.5476627575435136,0.4410481621831048,0.05582343750820954,0.7458898641846397,0.7867647437822252,0.11091549295774648,0.08626760563380281,0.20422535211267606,0.10387323943661972,0.15492957746478872,0.07746478873239436,0.02464788732394366,0.06338028169014084,0.017605633802816902,0.040492957746478875,0.03873239436619718,0.022887323943661973,257.0,0.8890845070422535,5.670774647887324,568.0,0.6312038014783526,0.6055966209081309,0.5966209081309398,0.5784054910242872,0.5567581837381204,0.5567581837381204,0.01689545934530095,0.021119324181626188,0.021119324181626188,0.022887323943661973,13.5063581575549,16.830073181231167,17.173022296789483,19.792509685751185,19.002082651743436,19.62225742574258,62.15454154111063,8.826086956521738,9.216237223975472,10059.14272656553,17.709758321418185,6.253465346534654,5.0,3.695208681427097,21.956521739130434,22.0,3.556723710646532,2.021782178217822,2.0,1.1979854344141765,505,151,0.299009900990099,3221,23,5
"Die ‘ Geschlechter-Aufsätze ’ von Wilhelm von Humboldt aus dem Jahr 1795 haben nachweislich eine bedeutende Rolle im Geschlechter-Diskurs gespielt . Allerdings sind bisher die poetologischen Maskulinisierungsstrategien , die in diesen Aufsätzen vorkommen , wenig beachtet worden . In diesem Beitrag soll es darum gehen , welche Implikationen von Geschlecht mit der Beschreibung poetischer und biologischer Hervorbringung in der aufkommenden Moderne verbunden waren . Seitdem sind alle drei - biologische und poetische Hervorbringung sowie ihre Beschreibungsweise - untrennbar miteinander verbunden . Humboldt erklärt die Beschreibung von Hervorbringung zur männlich-autogamen Praxis und macht Poiesis somit zur Angelegenheit der Männer . Humboldt argumentiert , dass die Beschreibung poetischer und biologischer Hervorbringung eine männlich-autogame Praxis ist und somit Poiesis zur Angelegenheit der Männer macht . Dieser Zusammenhang zwischen Geschlecht und Hervorbringung wird in seinen ' Geschlechter-Aufsätzen ' deutlich . Es wird untersucht , wie diese Aufsätze den Geschlechter-Diskurs beeinflusst haben und welche poetologischen Maskulinisierungsstrategien darin zum Einsatz kommen . Die Implikationen von Geschlecht in Bezug auf Hervorbringung und ihre Beschreibungsweise in der aufkommenden Moderne werden ebenfalls analysiert . Es wird gezeigt , dass Humboldt eine Verbindung herstellt zwischen biologischer und poetischer Hervorbringung und dass diese Verbindung mit Männlichkeit und Autogamie assoziiert wird . Diese Verbindung zwischen Geschlecht und Hervorbringung hat weitreichende Auswirkungen auf den Geschlechter-Diskurs und beeinflusst die Vorstellungen von Poiesis in der modernen Gesellschaft . Der Rest des ersten Abschnitts könnte wie folgt lauten : Humboldt argumentiert , dass die Beschreibung poetischer und biologischer Hervorbringung eine männlich-autogame Praxis ist und somit Poiesis zur Angelegenheit der Männer macht . Dieser Zusammenhang zwischen Geschlecht und Hervorbringung wird in seinen ' Geschlechter-Aufsätzen ' deutlich . Es wird untersucht , wie diese Aufsätze den Geschlechter-Diskurs beeinflusst haben und welche poetologischen Maskulinisierungsstrategien darin zum Einsatz kommen . Die Implikationen von Geschlecht in Bezug auf Hervorbringung und ihre Beschreibungsweise in der aufkommenden Moderne werden ebenfalls analysiert . Es wird gezeigt , dass Humboldt eine Verbindung herstellt zwischen biologischer und poetischer Hervorbringung und dass diese Verbindung mit Männlichkeit und Autogamie assoziiert wird . Diese Verbindung zwischen Geschlecht und Hervorbringung hat weitreichende Auswirkungen auf den Geschlechter-Diskurs und beeinflusst die Vorstellungen von Poiesis in der modernen Gesellschaft . Ziel dieses Beitrags ist es , die bisher wenig beachteten poetologischen Maskulinisierungsstrategien in Humboldts ' Geschlechter-Aufsätzen ' zu untersuchen und ihre Bedeutung für den Geschlechter-Diskurs aufzuzeigen . Dabei wird auch aufgezeigt , welche Implikationen von Geschlecht mit der Beschreibung poetischer und biologischer Hervorbringung in der aufkommenden Moderne verbunden waren . Es wird analysiert , wie Humboldt die Beschreibung von Hervorbringung als männlich-autogame Praxis darstellt und welche Auswirkungen dies auf das Verständnis von Poiesis und Geschlecht hat . Durch die Verbindung von biologischer und poetischer Hervorbringung wird die Vorstellung von Männlichkeit und Autogamie verstärkt und beeinflusst somit den Geschlechter-Diskurs . Dieser Beitrag trägt dazu bei , das Verständnis von Humboldts ' Geschlechter-Aufsätzen ' zu erweitern und ihre Bedeutung für die Geschlechterforschung hervorzuheben . Es wird erwartet , dass die Ergebnisse dieser Untersuchung neue Erkenntnisse über die poetologischen Maskulinisierungsstrategien in Humboldts ' Geschlechter-Aufsätzen ' liefern und somit zu einem umfassenderen Verständnis des Geschlechter-Diskurses beitragen . Darüber hinaus wird erwartet , dass die Analyse der Implikationen von Geschlecht in Bezug auf Hervorbringung und ihre Beschreibungsweise in der aufkommenden Moderne dazu beiträgt , die Vorstellungen von Poiesis und Geschlecht in der modernen Gesellschaft besser zu verstehen . Diese Erkenntnisse könnten auch Auswirkungen auf andere Bereiche der Geschlechterforschung haben und zu weiteren Diskussionen und Forschungen in diesem Bereich anregen . Insgesamt wird dieser Beitrag dazu beitragen , das Verständnis von Geschlecht und Hervorbringung in der Literatur und Gesellschaft zu erweitern und neue Perspektiven auf diese Themen bereitzustellen .",3.3412960516128853,0.735546774421518,0.49464722387259463,0.055874855327189825,0.7417784190177917,0.7886900280912718,0.095,0.07166666666666667,0.24833333333333332,0.11666666666666667,0.13833333333333334,0.08833333333333333,0.02,0.05,0.006666666666666667,0.05333333333333334,0.06666666666666667,0.018333333333333333,283.0,0.9016666666666666,6.653333333333333,600.0,0.569810498802004,0.550206926595513,0.550206926595513,0.5144848616859072,0.5144848616859072,0.5144848616859072,0.011762143323894577,0.011762143323894577,0.02940535830973644,0.06166666666666667,-16.926798183366458,20.799040590405912,18.367666899608576,21.991598069826853,23.179682089128583,25.45889298892988,66.04910587567414,9.423076923076923,11.4522416076505,94112.07211775001,156.85345352958336,7.25830258302583,6.0,4.920369147038651,20.846153846153847,21.0,5.544868089520031,2.3948339483394836,2.0,1.7392291284809873,542,170,0.31365313653136534,3992,26,6
"In der Antike wurde Vergil oft als der römische Homer bezeichnet , und diese Vergleichung hatte weitreichende Auswirkungen auf die Zuschreibung der Gedichte in der Appendix Vergiliana . Vergil selbst stilisierte sich in seiner Aeneis implizit zu einem zweiten Homer , indem er ähnliche epische Themen und Motive aufgriff . Diese Selbstdarstellung trug dazu bei , dass Autoren wie Martial , Statius oder Quintilian Gedichte aus der Appendix Vergiliana unter Vergils Namen zitierten . Besonders interessant sind hierbei die beiden im 1. Jh. n.Chr. bezeugten Gedichte aus der Appendix Vergiliana . Der Culex wurde bereits in den frühesten Testimonien der homerischen Batrachomyomachie gegenübergestellt , einem Gedicht , das Homer zugeschrieben wurde . Vergil wird hier also direkt mit Homer in Verbindung gebracht . Das zweite Epigramm aus dem Catalepton wiederum kann mit den homerischen Epigrammen und dem oft Homer zugeschriebenen Margites verglichen werden . Diese Vergleiche zeigen , dass die zeitgenössischen Autoren Vergil und Homer als ähnliche Dichter betrachteten und dass Vergil als würdiger Nachfolger Homers angesehen wurde . Durch die Verbindung mit Homer und die Selbstdarstellung als zweiter Homer schuf Vergil selbst eine wichtige Bedingung für das Wachsen seiner ‹Publikationsliste›. Autoren und Gelehrte der Zeit waren bereit , ihm Gedichte zuzuschreiben , die möglicherweise nicht von ihm verfasst wurden , aber seiner literarischen Tradition und Reputation entsprachen . Dies erklärt , warum Autoren wie Martial , Statius oder Quintilian Gedichte aus der Appendix Vergiliana unter Vergils Namen zitierten . Es war eine Art von literarischer Tradition , die Vergil selbst geschaffen hatte und die bis heute umstritten ist . In diesem Aufsatz wird untersucht , warum Autoren wie Martial , Statius oder Quintilian Gedichte aus der Appendix Vergiliana unter Vergils Namen zitierten . Ein wichtiger Faktor dafür war die Vergleichung von Vergil mit Homer , der ähnliche Gedichte verfasst haben soll . Die beiden im 1. Jh. n.Chr. bezeugten Gedichte aus der Appendix Vergiliana , der Culex und das zweite Epigramm aus dem Catalepton , werden direkt mit homerischen Werken verglichen . Diese Vergleiche zeigen , dass Vergil und Homer als ähnliche Dichter betrachtet wurden und Vergil als würdiger Nachfolger Homers angesehen wurde . Durch die Selbstdarstellung als zweiter Homer und die Verbindung zu diesem großen Vorbild schuf Vergil selbst die Grundlage für das Wachsen seiner "" Publikationsliste "" . Autoren und Gelehrte waren bereit , ihm Gedichte zuzuschreiben , die möglicherweise nicht von ihm verfasst wurden , aber in seine literarische Tradition und Reputation passten . Dies erklärt , warum Autoren wie Martial , Statius oder Quintilian Gedichte aus der Appendix Vergiliana unter Vergils Namen zitierten . Es entstand eine Art literarischer Tradition , die Vergil selbst geschaffen hatte und die bis heute umstritten ist . Die Vergil-Zuschreibungen in der Appendix Vergiliana waren also das Ergebnis einer Kombination aus Vergils Selbstdarstellung als zweiter Homer und der bereits bestehenden Vergleichung von Vergil mit Homer in der antiken Literatur . Diese Vergleiche und die damit verbundene Anerkennung als würdiger Nachfolger Homers führten dazu , dass Autoren und Gelehrte bereit waren , Gedichte der Appendix Vergiliana unter Vergils Namen zu zitieren . Es entstand eine Art literarischer Tradition , die Vergil selbst geschaffen hatte und die bis heute umstritten ist . In diesem Aufsatz werden die Gründe für diese Zuschreibungen genauer untersucht und diskutiert .",3.4630195491375355,0.7749924841572693,0.4655549164213227,0.0672424193126168,0.7433130795305426,0.7602758265676952,0.0974264705882353,0.06433823529411764,0.20404411764705882,0.11397058823529412,0.11764705882352941,0.07904411764705882,0.04044117647058824,0.06985294117647059,0.0055147058823529415,0.05330882352941176,0.04963235294117647,0.016544117647058824,246.0,0.8988970588235294,5.615808823529412,544.0,0.49499722067815455,0.42495831017231794,0.3743746525847693,0.3743746525847693,0.3743746525847693,0.3743746525847693,0.03001667593107282,0.0575319622012229,0.04168982768204558,0.03308823529411765,4.7673638537146985,17.897770300185957,18.007057608781377,21.24788807225715,18.041102452846893,18.7640733197556,59.84069777738422,8.217391304347826,8.918515965185955,7468.996749707677,13.729773436962642,6.114052953156823,6.0,3.2772787612075907,21.347826086956523,20.0,7.04401500907083,2.1323828920570267,2.0,1.2129604859857206,491,174,0.3543788187372709,3055,23,7
"Im Rahmen des Forschungskolloquiums werden verschiedene Fragestellungen behandelt , die sich mit bisher vernachlässigten Aspekten der Protestbewegungen der 1960er Jahre auseinandersetzen . Hierbei liegt der Fokus auf den Disziplinen Linguistik , Geschichtswissenschaft , Politologie , Soziologie und Literaturwissenschaft . Durch diese interdisziplinäre Herangehensweise wird ein breites Spektrum an Forschungsperspektiven ermöglicht , um so einen umfassenden Blick auf die Studentenbewegungen zu werfen . Das Forschungskolloquium dient als Plattform für den wissenschaftlichen Austausch und die Diskussion neuer Zugänge zur Historisierung der Studentenbewegung . Es ermöglicht Nachwuchswissenschaftlerinnen und -wissenschaftlern , ihre Forschungsprojekte vorzustellen und gemeinsam mit anderen Experten zu diskutieren . Dabei werden sowohl methodische Ansätze als auch theoretische Konzepte beleuchtet , um eine fundierte wissenschaftliche Behandlung der Protestbewegungen zu gewährleisten . Der Generationenwechsel von ehemaligen Aktivisten und Betroffenen hin zu einer neuen Generation von Wissenschaftlerinnen und Wissenschaftlern eröffnet dabei die Möglichkeit für frische Perspektiven und neue Erkenntnisse . Durch die Einbindung verschiedener Fachdisziplinen werden interdisziplinäre Zusammenhänge aufgedeckt und ein ganzheitliches Verständnis der Protestbewegungen ermöglicht . Das Forschungskolloquium bietet somit nicht nur eine Plattform für den wissenschaftlichen Austausch , sondern trägt auch zur Weiterentwicklung der historischen Wissenschaften im Hinblick auf die Protestbewegungen der 1960er und 1970er Jahre bei . Es wird erwartet , dass die Ergebnisse dieser Forschungsarbeit zu einem vertieften Verständnis und einer differenzierteren Betrachtung dieser bedeutenden sozialen Bewegungen führen werden . Die breite Beteiligung von Nachwuchswissenschaftlerinnen und -wissenschaftlern aus verschiedenen Disziplinen ermöglicht eine vielfältige Herangehensweise an das Thema und verspricht eine umfassende Analyse der Studentenbewegungen . Durch den interdisziplinären Austausch werden neue Erkenntnisse und Zusammenhänge aufgedeckt , die bisher vernachlässigt wurden . Das Forschungskolloquium stellt somit nicht nur eine Plattform für den wissenschaftlichen Austausch dar , sondern trägt auch zur Weiterentwicklung der historischen Wissenschaften im Hinblick auf die Protestbewegungen der 1960er und 1970er Jahre bei . Es wird erwartet , dass die Ergebnisse dieser Forschungsarbeit zu einem vertieften Verständnis und einer differenzierteren Betrachtung dieser bedeutenden sozialen Bewegungen führen werden . Das Forschungskolloquium bietet den Teilnehmenden die Möglichkeit , ihre Forschungsprojekte vorzustellen und anhand von Diskussionen und Feedback weiterzuentwickeln . Dabei werden sowohl empirische Studien als auch theoretische Überlegungen präsentiert und kritisch beleuchtet . Ziel ist es , die Protestbewegungen der 1960er Jahre aus verschiedenen Perspektiven zu betrachten und somit ein umfassendes Bild dieser historischen Ereignisse zu zeichnen . Ein weiterer Schwerpunkt des Forschungskolloquiums liegt auf der methodischen Herangehensweise an das Thema . Es werden verschiedene Ansätze und Methoden vorgestellt und diskutiert , um die Forschungsfragen bestmöglich zu beantworten . Dabei werden auch innovative Methoden wie beispielsweise Text- und Diskursanalysen eingesetzt , um neue Erkenntnisse zu gewinnen . Darüber hinaus werden im Rahmen des Forschungskolloquiums auch neue theoretische Konzepte und Ansätze zur Analyse der Protestbewegungen vorgestellt . Hierbei wird der Fokus auf aktuelle theoretische Entwicklungen gelegt , die helfen sollen , die Protestbewegungen in einen größeren gesellschaftlichen Kontext einzuordnen und zu verstehen . Die Veranstaltung bietet den Teilnehmenden zudem die Möglichkeit , sich mit renommierten Expertinnen und Experten auf dem Gebiet auszutauschen und von deren Erfahrungen und Expertise zu profitieren . Dies fördert den interdisziplinären Austausch und ermöglicht eine umfassende und fundierte Bearbeitung des Themas . Zusammenfassend bietet das "" Interdisziplinäre Forschungskolloquium Protestbewegungen "" eine Plattform für den wissenschaftlichen Austausch und die Weiterentwicklung der historischen Wissenschaften im Hinblick auf die Protestbewegungen der 1960er und 1970er Jahre . Durch die interdisziplinäre Herangehensweise , den Fokus auf bisher vernachlässigte Aspekte und die Einbindung verschiedener Fachdisziplinen wird ein umfassendes Verständnis dieser bedeutenden sozialen Bewegungen angestrebt . Die Ergebnisse dieser Forschungsarbeit werden dazu beitragen , die Protestbewegungen der 1960er Jahre differenzierter zu betrachten und zu verstehen .",3.3696984992971815,0.8068036155395312,0.44179482130341585,0.0869169700992851,0.7820395838755828,0.7870245110988617,0.08460236886632826,0.1218274111675127,0.2521150592216582,0.08460236886632826,0.15397631133671744,0.09137055837563451,0.02030456852791878,0.05414551607445008,0.021996615905245348,0.032148900169204735,0.06598984771573604,0.01015228426395939,257.0,0.9153976311336718,7.028764805414552,591.0,0.25295109612141653,0.23524451939291738,0.21732715008431702,0.19435075885328837,0.19435075885328837,0.165893760539629,0.006323777403035413,0.03541315345699832,0.03372681281618887,0.01353637901861252,-25.39353529129866,21.7789730950914,19.099076657604872,23.615554186349012,24.31835215992333,27.328133086876154,64.39932908879305,8.88888888888889,11.20040630644663,73160.16124056188,123.79045895188135,7.585951940850277,6.0,5.143280388148201,20.037037037037038,19.0,5.38503744257062,2.5046210720887245,2.0,1.6845708697999378,541,218,0.4029574861367837,4154,27,8
"zu lachen und dies somit kontrolliert wird . Die vorliegende Studie liefert somit erste Hinweise darauf , dass es ein spezifisches Lachen der Schadenfreude gibt , welches jedoch häufig durch soziale Normen und Regulierungsmechanismen beeinflusst wird . Diese Ergebnisse tragen dazu bei , das Verständnis für die Mimik und den Ausdruck von Schadenfreude zu erweitern und werfen weitere Fragen auf , die in zukünftigen Studien untersucht werden sollten . Die vorliegende Studie baut auf früheren Arbeiten auf , bei denen die Häufigkeit und Intensität von Lächeln und Lachen in verschiedenen positiven Emotionen untersucht wurden . Dabei wurde festgestellt , dass nicht nur Erheiterung systematisch mit Lachen und intensiveren mimischen Reaktionen einhergeht , sondern auch Schadenfreude . Basierend auf diesen Ergebnissen wurden in der vorliegenden Studie drei Hypothesen zum mimischen Ausdruck von Schadenfreude getestet . Die Ergebnisse zeigen , dass Schadenfreude oft mit Lachen verbunden ist ( in 70 % der Schadenfreude-Erlebnisse ) und dass die mimischen Ausdrücke häufig durch Marker der Regulierung oder Dämpfung des Ausdrucks gekennzeichnet sind . Dies deutet darauf hin , dass Schadenfreude zwar durch den typischen Gesichtsausdruck von Freude gezeigt wird , im sozialen Kontext jedoch oft eine sichtbare Abschwächung oder ein Verbergen des Ausdrucks stattfindet . Dies könnte darauf zurückzuführen sein , dass es sozial nicht akzeptabel ist , über den Schaden anderer zu lachen und dies daher kontrolliert wird . Die vorliegende Studie liefert somit erste Hinweise darauf , dass es ein spezifisches Lachen der Schadenfreude gibt , das jedoch häufig durch soziale Normen und Regulierungsmechanismen beeinflusst wird . Diese Ergebnisse erweitern das Verständnis für die Mimik und den Ausdruck von Schadenfreude und werfen weitere Fragen auf , die in zukünftigen Studien untersucht werden sollten . Die vorliegende Studie untersucht den mimischen Ausdruck von Schadenfreude anhand von 17 erinnerten Schadenfreude-Erlebnissen . Dabei wurde festgestellt , dass Schadenfreude sehr häufig mit Lachen einhergeht , und zwar in 70 % der Schadenfreude-Erlebnisse . Zusätzlich waren die mimischen Ausdrücke oft durch Marker der Regulierung oder Dämpfung des Ausdrucks gekennzeichnet . Dies legt nahe , dass Schadenfreude zwar durch den typischen Gesichtsausdruck von Freude gezeigt wird , im sozialen Kontext jedoch oft eine sichtbare Abschwächung oder ein Verbergen des Ausdrucks stattfindet . Dies könnte darauf zurückzuführen sein , dass es sozial nicht akzeptabel ist , über den Schaden anderer zu lachen und dies daher kontrolliert wird . Die Ergebnisse dieser Studie liefern somit erste Hinweise darauf , dass es ein spezifisches Lachen der Schadenfreude gibt , das jedoch häufig durch soziale Normen und Regulierungsmechanismen beeinflusst wird . Diese Erkenntnisse tragen dazu bei , das Verständnis für die Mimik und den Ausdruck von Schadenfreude zu erweitern und werfen weitere Fragen auf , die in zukünftigen Studien untersucht werden sollten . Die vorliegende Studie untersucht den mimischen Ausdruck von Schadenfreude anhand von 17 erinnerten Schadenfreude-Erlebnissen . Dabei wurde festgestellt , dass Schadenfreude sehr häufig mit Lachen einhergeht , und zwar in 70 % der Schadenfreude-Erlebnisse . Zusätzlich waren die mimischen Ausdrücke oft durch Marker der Regulierung oder Dämpfung des Ausdrucks gekennzeichnet . Dies legt nahe , dass Schadenfreude zwar durch den typischen Gesichtsausdruck von Freude gezeigt wird , im sozialen Kontext jedoch oft eine sichtbare Abschwächung oder ein Verbergen des Ausdrucks stattfindet . Dies könnte darauf zurückzuführen sein , dass es sozial nicht akzeptabel ist , über den Schaden anderer zu lachen und dies daher kontrolliert wird . Die Ergebnisse dieser Studie liefern somit erste Hinweise darauf , dass es ein spezifisches Lachen der Schadenfreude gibt , das jedoch häufig durch soziale Normen und Regulierungsmechanismen beeinflusst wird . Diese Erkenntnisse tragen dazu bei , das Verständnis für die Mimik und den Ausdruck von Schadenfreude zu erweitern und werfen weitere Fragen auf , die in zukünftigen Studien untersucht werden sollten .",3.8597409165114946,0.6247188140852157,0.4322660542872445,0.05281083729366327,0.7685945282379786,0.736453476159469,0.1,0.07419354838709677,0.20806451612903226,0.1,0.1064516129032258,0.10483870967741936,0.0467741935483871,0.1,0.017741935483870968,0.05967741935483871,0.0467741935483871,0.024193548387096774,295.0,0.8870967741935484,5.774193548387097,620.0,0.8554417718504406,0.8468683019766611,0.8390092879256966,0.8390092879256966,0.8390092879256966,0.822100500119076,0.020004763038818766,0.015003572279114075,0.02857823291259824,0.014516129032258065,6.718216216216263,17.837369369369366,17.671377868339608,20.555675675675676,19.5,20.10666666666666,57.33513513513513,7.8,9.792394799955982,17897.114898009473,28.866314351628183,6.333333333333333,6.0,3.9229822571342057,22.2,24.0,6.29285308902091,2.099099099099099,2.0,1.4049779899847292,555,136,0.24504504504504504,3580,25,9
