text,dependency_distance_mean,dependency_distance_std,prop_adjacent_dependency_relation_mean,prop_adjacent_dependency_relation_std,first_order_coherence,second_order_coherence,pos_prop_PUNCT,pos_prop_ADJ,pos_prop_NOUN,pos_prop_ADP,pos_prop_DET,pos_prop_VERB,pos_prop_PRON,pos_prop_ADV,pos_prop_PART,pos_prop_AUX,pos_prop_CCONJ,pos_prop_SCONJ,n_stop_words,alpha_ratio,mean_word_length,doc_length,duplicate_ngram_chr_fraction_5,duplicate_ngram_chr_fraction_6,duplicate_ngram_chr_fraction_7,duplicate_ngram_chr_fraction_8,duplicate_ngram_chr_fraction_9,duplicate_ngram_chr_fraction_10,top_ngram_chr_fraction_2,top_ngram_chr_fraction_3,top_ngram_chr_fraction_4,oov_ratio,flesch_reading_ease,flesch_kincaid_grade,smog,gunning_fog,automated_readability_index,coleman_liau_index,lix,rix,entropy,perplexity,per_word_perplexity,token_length_mean,token_length_median,token_length_std,sentence_length_mean,sentence_length_median,sentence_length_std,syllables_per_token_mean,syllables_per_token_median,syllables_per_token_std,n_tokens,n_unique_tokens,proportion_unique_tokens,n_characters,n_sentences,file_id
"Ausonius ' geschickte Bezugnahme auf die antike Vergil-Kritik ermöglicht es ihm , die pornographisch-obszöne Passage seines Hochzeits-Cento , die Defloration der Braut , spielerisch zu entschärfen . Dabei werden sowohl implizite als auch explizite Referenzen auf die obtrectatores Vergilii verwendet , die in der Schultradition als Heuchler und Pedanten desavouiert wurden . Diese Referenzen übernehmen im Text eine zentrale apologetische Funktion , indem potentielle Obszönitätsvorwürfe auf den Leser zurückgeworfen werden . Ausonius überspitzt satirisch eine bestimmte Rezeptionshaltung und stellt den Leser somit in die Position eines obszönen Lesers . Durch diese manipulative Leserführung gewährleistet Ausonius jedoch gleichzeitig , dass den Rezipienten weder die sexuelle Allegorese der imminutio noch die des vergilischen Prätextes entgeht . Die Vergil-Kritik spielt eine wichtige Rolle in Ausonius ' apologetischer Strategie . Durch die geschickte Einbindung der obtrectatores Vergilii in den Text lenkt Ausonius die potentiellen Obszönitätsvorwürfe auf den Leser selbst . Indem er den Leser in die Position eines obszönen Lesers stellt , überspitzt er satirisch eine bestimmte Rezeptionshaltung . Gleichzeitig sorgt Ausonius dafür , dass den Rezipienten weder die sexuelle Allegorese der imminutio noch die des vergilischen Prätextes entgeht . Auf diese Weise gelingt es ihm , die pornographisch-obszöne Passage seines Hochzeits-Cento spielerisch zu entschärfen und gleichzeitig die apologetische Funktion der Vergil-Kritik herauszustellen . Die Vergil-Kritik spielt eine wichtige Rolle in Ausonius ' apologetischer Strategie . Durch die geschickte Einbindung der obtrectatores Vergilii in den Text lenkt Ausonius die potentiellen Obszönitätsvorwürfe auf den Leser selbst . Indem er den Leser in die Position eines obszönen Lesers stellt , überspitzt er satirisch eine bestimmte Rezeptionshaltung . Gleichzeitig sorgt Ausonius dafür , dass den Rezipienten weder die sexuelle Allegorese der imminutio noch die des vergilischen Prätextes entgeht . Auf diese Weise gelingt es ihm , die pornographisch-obszöne Passage seines Hochzeits-Cento spielerisch zu entschärfen und gleichzeitig die apologetische Funktion der Vergil-Kritik herauszustellen . Die apologetische Strategie von Ausonius wird durch die geschickte Verwendung von Vergil-Kritik in seinem Text verstärkt . Indem er die obtrectatores Vergilii , die in der Schultradition als Heuchler und Pedanten desavouiert wurden , in den Text einfügt , lenkt Ausonius die Aufmerksamkeit weg von der pornographischen Passage hin zu den potentiellen Obszönitätsvorwürfen . Der Leser wird somit in die Position eines obszönen Lesers gestellt und Ausonius überspitzt satirisch eine bestimmte Rezeptionshaltung . Gleichzeitig stellt er sicher , dass den Rezipienten weder die sexuelle Allegorese der imminutio noch die des vergilischen Prätextes entgeht . Durch diese manipulative Leserführung gelingt es Ausonius , die pornographisch-obszöne Passage spielerisch zu entschärfen und gleichzeitig die apologetische Funktion der Vergil-Kritik zu betonen . Zusammenfassend lässt sich sagen , dass Ausonius in seinem Cento nuptialis geschickt auf die antike Vergil-Kritik Bezug nimmt , um die pornographisch-obszöne Passage zu entschärfen . Durch die Verwendung von impliciten und expliziten Referenzen auf die obtrectatores Vergilii , die in der Schultradition als Heuchler und Pedanten abgelehnt wurden , lenkt Ausonius potentielle Obszönitätsvorwürfe auf den Leser selbst . Indem er den Leser in die Rolle eines obszönen Lesers stellt , überspitzt Ausonius satirisch eine bestimmte Rezeptionshaltung . Gleichzeitig sorgt er dafür , dass den Rezipienten weder die sexuelle Allegorese der imminutio noch die des vergilischen Prätextes entgeht . Auf diese Weise gelingt es ihm , die pornographisch-obszöne Passage des Hochzeits-Centos spielerisch zu entschärfen und gleichzeitig die apologetische Funktion der Vergil-Kritik herauszustellen .",3.598361735616844,0.7330759470520887,0.3735150292692088,0.06999983653004466,0.7907428815960884,0.7814955607704495,0.09506398537477148,0.10603290676416818,0.22120658135283364,0.07495429616087751,0.18281535648994515,0.09140767824497258,0.04753199268738574,0.07678244972577697,0.012797074954296161,0.012797074954296161,0.031078610603290677,0.021937842778793418,219.0,0.9049360146252285,6.292504570383913,547.0,0.731444332998997,0.6835506519558676,0.6384152457372116,0.6010531594784353,0.5845035105315948,0.5845035105315948,0.011283851554663993,0.05115346038114343,0.04513540621865597,0.12431444241316271,-20.40381818181814,21.024121212121212,19.287186520377343,24.08161616161616,20.726363636363637,22.97414141414141,64.04242424242425,8.76,10.154562462046382,25708.127397728877,46.9984047490473,6.848484848484849,6.0,4.249215343760448,19.8,19.0,4.841487374764082,2.4484848484848483,2.0,1.7270494273522996,495,122,0.24646464646464647,3442,25,1
"Die Bedeutung der Vasenbilder für die Rezeption der Ilias und insbesondere des 24. Buches , HEKTOROS LYTRA , wird in diesem Artikel näher untersucht . Ein Beispiel dafür ist eine attische Amphora , die 1986 in Zürich veröffentlicht und auf etwa 565 v.Chr. datiert wurde . Ein weiteres Beispiel ist ein korinthischer Teller , der 1976 auftauchte und nun im Princeton University Art Museum ausgestellt ist . Obwohl dieser Teller auf etwa 580 v.Chr. datiert wurde , wurde er bisher kaum beachtet . Dies könnte vor allem daran liegen , dass der angesehene Experte D.A. Amyx Bedenken hinsichtlich seiner Echtheit äußerte . Diese Bedenken wurden jedoch mittlerweile ausgeräumt . Zusammen mit weiteren Darstellungen , wie beispielsweise den "" Leichenspielen des Patroklos "" von Sophilos , wird deutlich , dass der Inhalt des 23. und 24. Buches der Ilias , also der eigenwillige Abschluss des Epos , bereits um 580 v.Chr. in Korinth und um 570 / 560 v.Chr. in Athen bekannt und sogar berühmt war - und das noch vor der Zeit von Peisistratos . Die vorliegende Studie untersucht die Bedeutung dieser Vasenbilder für die Rezeption der Ilias und insbesondere des 24. Buches , HEKTOROS LYTRA . Durch die Analyse dieser Beispiele wird ein tieferes Verständnis dafür gewonnen , wie die Ilias im antiken Griechenland rezipiert und interpretiert wurde . Die attische Amphora aus dem Jahr 565 v.Chr. und der korinthische Teller aus dem Jahr 580 v.Chr. bieten wertvolle Einblicke in die zeitgenössische Wahrnehmung des Epos und zeigen , dass der eigenwillige Abschluss des 23. und 24. Buches bereits zu dieser Zeit bekannt und geschätzt war . Diese Erkenntnisse werfen auch ein neues Licht auf die Frage nach der Autorität und dem Einfluss von Peisistratos , der oft als erster bekannter Rezipient der Ilias angesehen wird . Die vorliegende Studie trägt somit zur Klärung der homerischen Chronologie und zur Erforschung der antiken Rezeption von Dichtung bei . In dieser Studie werden die Bedeutung der Vasenbilder für die Rezeption der Ilias und insbesondere des 24. Buches , HEKTOROS LYTRA , untersucht . Durch die Analyse dieser Beispiele wird ein tieferes Verständnis dafür gewonnen , wie die Ilias im antiken Griechenland rezipiert und interpretiert wurde . Die attische Amphora aus dem Jahr 565 v.Chr. und der korinthische Teller aus dem Jahr 580 v.Chr. bieten wertvolle Einblicke in die zeitgenössische Wahrnehmung des Epos und zeigen , dass der eigenwillige Abschluss des 23. und 24. Buches bereits zu dieser Zeit bekannt und geschätzt war . Diese Erkenntnisse werfen auch ein neues Licht auf die Frage nach der Autorität und dem Einfluss von Peisistratos , der oft als erster bekannter Rezipient der Ilias angesehen wird . Die vorliegende Studie trägt somit zur Klärung der homerischen Chronologie und zur Erforschung der antiken Rezeption von Dichtung bei . Die Erforschung der Rezeption und Interpretation der Ilias im antiken Griechenland ist von großer Bedeutung für unser Verständnis dieses epischen Werkes . Während die genaue Datierung der Ilias selbst nach wie vor umstritten ist , können wir durch die Untersuchung von wohldatierten Vasenbildern wertvolle Einblicke in die zeitgenössische Wahrnehmung des Epos gewinnen . Insbesondere die Darstellungen des 24. Buches , HEKTOROS LYTRA , auf einer attischen Amphora und einem korinthischen Teller bieten hierbei interessante Informationen . Die attische Amphora , die um 565 v.Chr. in Zürich veröffentlicht wurde , zeigt eine Szene aus dem 24. Buch der Ilias , in der ein wichtiger Aspekt der Handlung dargestellt wird . Die detaillierte Darstellung und die hochwertige Ausführung des Bildes lassen darauf schließen , dass die Ilias zu dieser Zeit bereits als bedeutendes Werk angesehen wurde . Ähnlich verhält es sich mit dem korinthischen Teller , der auf etwa 580 v.Chr. datiert wurde und eine ähnliche Szene zeigt . Obwohl dieser Teller bisher kaum Beachtung fand , ist seine Bedeutung für die Rezeption der Ilias nicht zu unterschätzen . Die Analyse dieser Vasenbilder ermöglicht es uns , die zeitgenössische Wahrnehmung der Ilias genauer zu verstehen . Sie zeigt , dass der eigenwillige Abschluss des Epos , wie er in den Büchern 23 und 24 dargestellt wird , bereits in dieser Zeit bekannt und geschätzt war . Dies wirft auch ein neues Licht auf die Frage nach der Autorität und dem Einfluss von Peisistratos , der oft als erster bekannter Rezipient der Ilias angesehen wird . Es scheint , dass die Ilias bereits vor seiner Zeit als bedeutendes Werk angesehen wurde , was darauf hindeutet , dass die Rezeption und Interpretation der Ilias im antiken Griechenland viel früher begann als bisher angenommen . Die vorliegende Studie trägt somit zur Klärung der homerischen Chronologie und zur Erforschung der antiken Rezeption von Dichtung bei",3.3821620090905533,0.816574605677589,0.43257116889139985,0.04495796267275579,0.7656033177460942,0.7766850701084843,0.08961038961038961,0.09220779220779221,0.19090909090909092,0.1012987012987013,0.16753246753246753,0.07272727272727272,0.02857142857142857,0.07402597402597402,0.003896103896103896,0.04155844155844156,0.045454545454545456,0.01818181818181818,366.0,0.8766233766233766,5.224675324675324,770.0,0.5505008347245409,0.5252504173622704,0.49457429048414026,0.4795492487479132,0.44052587646076796,0.44052587646076796,0.024415692821368948,0.010434056761268781,0.017529215358931552,0.03506493506493506,22.272039942938676,16.157926115401647,17.202604967454466,19.711761522947512,17.223025726794233,16.14168330955777,55.41349795858134,7.551724137931035,14.66084735111967,2328761.993609751,3024.366225467209,5.640513552068474,5.0,3.0817231722831093,24.17241379310345,21.0,9.972614105872008,1.891583452211127,1.0,1.1138861188791853,701,224,0.3195435092724679,4023,29,2
"Die allographen Prologe von Hugo von Hofmannsthal stellen eine interessante Möglichkeit dar , literarisch das Gefühl der Zeitgenossenschaft zu erzeugen . Im Gegensatz zu den traditionellen Prologen , die die Handlung eines Dramas einführen , dienen sie nicht dazu , Informationen über die Geschichte oder die Charaktere zu vermitteln . Stattdessen fungieren sie als Mittel , um eine gemeinsame zeitliche Perspektive zu schaffen . Dies wird besonders deutlich in Hofmannsthals Prologen zu den Dramen Anatol von Arthur Schnitzler und Mimi von Clara Loebs . Die Rezeptionsgeschichte der allographen Prologe zeigt , dass diese Funktion der Zeitgenossenschaft auch über den spezifischen Kontext der jeweiligen Dramen hinausreicht . Die Prologe können zitiert und in andere literarische Werke übertragen werden , wodurch sie zu einem eigenständigen Ausdruck des zeitlichen In-Verbindungretens werden . Dies wird abschließend anhand von Hofmannsthals Verhältnis zu Thomas Mann verdeutlicht . Obwohl Hofmannsthal distanziert von Mann war , lässt sich dennoch eine Verbindung zwischen den beiden Schriftstellern herstellen , indem Hofmannsthals allographer Prolog als Mittel der Zeitgenossenschaft betrachtet wird . Es ist bemerkenswert , dass Hofmannsthals allographe Prologe nicht nur als literarische Elemente im Kontext der jeweiligen Dramen funktionieren , sondern auch unabhängig davon ihre Wirkung entfalten können . Sie können als eigenständige Ausdrucksformen dienen , die das Gefühl der Zeitgenossenschaft vermitteln . Dies verdeutlicht die Fähigkeit der Prologe , zitiert und in andere literarische Werke übertragen zu werden . Dadurch eröffnet sich die Möglichkeit , über verschiedene Kontexte hinweg eine gemeinsame zeitliche Perspektive herzustellen . Ein interessantes Beispiel für diese Übertragbarkeit der Prologe ist Hofmannsthals Verhältnis zu Thomas Mann . Obwohl die beiden Schriftsteller eine gewisse Distanz zueinander hatten , lässt sich dennoch eine Verbindung zwischen ihnen herstellen , indem man Hofmannsthals allographen Prolog als Ausdruck des zeitlichen In-Verbindungretens betrachtet . Indem Hofmannsthal diese Form des Prologs in seinen Werken verwendet , schafft er eine Brücke zu anderen zeitgenössischen Schriftstellern wie Mann . Dies zeigt , dass die allographen Prologe nicht nur als dramatische Formelemente dienen , sondern auch als Mittel zur Schaffung einer gemeinsamen zeitgenössischen Erfahrung fungieren können . Insgesamt stellen die allographen Prologe von Hugo von Hofmannsthal eine interessante Möglichkeit dar , das Gefühl der Zeitgenossenschaft literarisch zu erzeugen . Sie dienen nicht nur als Einführung in die Handlung eines Dramas , sondern schaffen eine gemeinsame zeitliche Perspektive , die über den spezifischen Kontext der jeweiligen Werke hinausreicht . Die Rezeptionsgeschichte der Prologe verdeutlicht zudem ihre Zitierbarkeit und Übertragbarkeit , was sie zu einem eigenständigen Ausdruck des zeitlichen In-Verbindungretens macht . Dieser Aspekt wird am Beispiel von Hofmannsthals Verhältnis zu Thomas Mann verdeutlicht . Durch die Betrachtung der allographen Prologe als Mittel der Zeitgenossenschaft kann eine Verbindung zwischen verschiedenen Schriftstellern und literarischen Werken hergestellt werden . Es ist bemerkenswert , dass Hofmannsthals allographe Prologe nicht nur als literarische Elemente im Kontext der jeweiligen Dramen funktionieren , sondern auch unabhängig davon ihre Wirkung entfalten können . Sie können als eigenständige Ausdrucksformen dienen ,",3.3962914117098437,0.6512330864673351,0.4130066111254623,0.05927373579713637,0.7955614003268155,0.7720031624748593,0.09896907216494845,0.09690721649484536,0.20412371134020618,0.09896907216494845,0.13814432989690723,0.09484536082474226,0.04742268041237113,0.05979381443298969,0.020618556701030927,0.03917525773195876,0.020618556701030927,0.02268041237113402,209.0,0.9010309278350516,6.272164948453608,485.0,0.35847986386840613,0.3272830402722632,0.27680090754395914,0.22234826999432786,0.14917753828701077,0.14917753828701077,0.03743618831537152,0.024957458876914352,0.028077141236528644,0.05567010309278351,-1.9772311212814202,18.25524027459954,18.007057608781377,21.879176201373,20.339427917620142,22.9275057208238,62.47826086956522,8.26086956521739,7.055029624990961,1158.6717964125849,2.3890140132218245,6.851258581235698,6.0,3.99351069944618,19.0,20.0,5.882915574115773,2.240274599542334,2.0,1.3220287847325614,437,172,0.39359267734553777,3042,23,3
"Die vorliegende Arbeit konzentriert sich auf die Analyse von zwei spätmittelalterlichen Kurzerzählungen , nämlich "" Die Witwe von Ephesus "" und "" Der Rache des Ehemanns "" . Während die Forschung in den letzten Jahren bereits beträchtliche Fortschritte bei der differenzierten Beschreibung solcher kleinerer narrativer Formen des Spätmittelalters gemacht hat , steht sie jedoch immer noch vor der Herausforderung , die diskursiven Bezüge dieser Texte und ihre autoreferentiellen Momente in ein angemessenes Verhältnis zu setzen . Der vorliegende Beitrag nimmt sich dieser Herausforderung an und argumentiert , dass viele der untersuchten Texte in konstitutiver Weise von einer doppelten Logik der Selbst- wie der Weltreferenz bestimmt sind . Dies bedeutet , dass sie sowohl auf sich selbst als auch auf die Welt außerhalb des Textes verweisen und somit eine komplexe Beziehung zwischen Erzählung und Realität herstellen . Um diese Argumentation zu untermauern , wird eine neue Lektüre der "" Witwe von Ephesus "" und "" Der Rache des Ehemanns "" vorgenommen . Dabei werden die textuellen Elemente und die darin enthaltenen sprachlichen Wendungen genauer untersucht , um die doppelte Logik der Selbst- und Weltreferenz aufzuzeigen . Durch diese Analyse wird deutlich , wie die beiden Kurzerzählungen auf subtile Weise sowohl die erzählten Geschichten als auch die gesellschaftlichen Normen und Wertvorstellungen ihrer Zeit kritisch reflektieren . Die Ergebnisse dieser Untersuchung tragen dazu bei , das Verständnis der spätmittelalterlichen Kurzerzählungen zu erweitern und liefern neue Erkenntnisse über ihre diskursiven Bezüge und autoreferentiellen Momente . Darüber hinaus bieten sie Anknüpfungspunkte für zukünftige Forschungen im Bereich der narrativen Formen des Spätmittelalters und ermöglichen eine differenzierte Analyse der Komplexität und Vielschichtigkeit dieser Texte . Die doppelte Logik der Selbst- und Weltreferenz in den untersuchten spätmittelalterlichen Kurzerzählungen hat auch Auswirkungen auf die Darstellung von Verletzungen und körperlichen Gewalttaten in den Texten . Durch die Verbindung von Erzählung und Realität werden nicht nur die Worte und Handlungen der Figuren in den Geschichten verletzend , sondern auch die körperlichen Zustände und Verletzungen der Protagonisten selbst . In beiden Kurzerzählungen werden die physische und emotionale Zerstörung der Figuren durch verletzende Worte und Handlungen thematisiert . In der "" Witwe von Ephesus "" wird die Witwe von ihrem eigenen Ehemann wegen ihres vermeintlichen Ehebruchs verurteilt . Die Worte und Anschuldigungen ihres Ehemanns führen zu einer tiefen Verletzung ihres Körpers und ihrer Seele . Sie verliert an Gewicht , wird krank und kann schließlich nur noch durch das Essen von Leichenteilen überleben . Ihre körperliche Verstümmelung symbolisiert die Zerstörung ihrer Identität und ihres bisherigen Lebens durch die Worte und das Verhalten ihres Ehemanns . Ähnlich ist es in "" Der Rache des Ehemanns "" , in dem ein Ehemann von seiner Frau betrogen wird . Die Ehefrau begeht Ehebruch und wird vom Ehemann für ihre Untreue bestraft . Er verstümmelt sie sowohl körperlich als auch emotional , indem er ihr die Nase und die Ohren abschneidet . Diese körperlichen Verletzungen spiegeln die Verletzungen wider , die der Ehemann durch den Ehebruch seiner Frau erlitten hat . Die doppelte Logik der Selbst- und Weltreferenz zeigt sich hier in der Art und Weise , wie die Verletzungen der Figuren sowohl auf ihre eigenen Handlungen als auch auf die gesellschaftlichen Normen und Wertvorstellungen verweisen . Die Analyse der doppelten Logik der Selbst- und Weltreferenz in den untersuchten Kurzerzählungen verdeutlicht somit die komplexe Beziehung zwischen Erzählung und Realität . Die Verbindung von Worten und Handlungen , von Sprache und Körperlichkeit wird genutzt , um die Verletzungen der Figuren sowohl auf psychologischer als auch auf physischer Ebene darzustellen . Dies zeigt die Bedeutung der untersuchten Kurzerzählungen für das Verständnis der spätmittelalterlichen Literatur und ihrer diskursiven Bezüge .",3.4441678446300514,0.9212518118498121,0.450061880120798,0.07277952637530043,0.7642576253932455,0.7574976899407126,0.08833333333333333,0.09166666666666666,0.245,0.09666666666666666,0.18833333333333332,0.065,0.03,0.056666666666666664,0.006666666666666667,0.02666666666666667,0.07666666666666666,0.013333333333333334,285.0,0.9116666666666666,5.828333333333333,600.0,0.1591796875,0.13427734375,0.06640625,0.06640625,0.0244140625,0.0244140625,0.008544921875,0.020751953125,0.0205078125,0.023333333333333334,5.531074421084725,18.149938299817183,18.062587368997235,21.10935405240707,19.620751066422912,19.922705667276052,61.00007617306521,8.708333333333334,13.077791271995416,478203.31775787513,797.0055295964586,6.296160877513711,5.0,3.8656651879377244,22.791666666666668,22.0,7.076835254704056,2.106032906764168,2.0,1.3149749870120797,547,238,0.4351005484460695,3497,24,4
