text,dependency_distance_mean,dependency_distance_std,prop_adjacent_dependency_relation_mean,prop_adjacent_dependency_relation_std,first_order_coherence,second_order_coherence,pos_prop_AUX,pos_prop_ADJ,pos_prop_ADP,pos_prop_NUM,pos_prop_NOUN,pos_prop_VERB,pos_prop_DET,pos_prop_PROPN,pos_prop_PUNCT,pos_prop_ADV,pos_prop_PART,pos_prop_SCONJ,pos_prop_PRON,pos_prop_CCONJ,passed_quality_check,n_stop_words,alpha_ratio,mean_word_length,doc_length,duplicate_ngram_chr_fraction_5,duplicate_ngram_chr_fraction_6,duplicate_ngram_chr_fraction_7,duplicate_ngram_chr_fraction_8,top_ngram_chr_fraction_2,top_ngram_chr_fraction_3,top_ngram_chr_fraction_4,oov_ratio,flesch_reading_ease,flesch_kincaid_grade,smog,gunning_fog,automated_readability_index,coleman_liau_index,lix,rix,entropy,perplexity,per_word_perplexity,token_length_mean,token_length_median,token_length_std,sentence_length_mean,sentence_length_median,sentence_length_std,syllables_per_token_mean,syllables_per_token_median,syllables_per_token_std,n_tokens,n_unique_tokens,proportion_unique_tokens,n_characters,n_sentences,file_id
"Being fluent in more than one foreign language has become a major educational goal in Europe [ REF ] . However , teaching foreign languages in conjunction with English as a global foreign language seems to pose a challenge , since the simultaneous learning of English is believed to lead to negative interferences with students ’ motivation to learn other languages [ REF ] . This appears to be a general European phenomenon [ REF ] , as cross - sectional research from several countries has repeatedly shown that students usually report lower value beliefs and motivation to learn languages other than English [ REF ] . Still less is known about longitudinal relations between students ’ motivation for several languages . Moreover , the motivational development might not be the same for all students . Previous studies indicate systematic individual differences in students ’ motivational beliefs depending , for instance , on their gender , language background [ REF ] , or experience with learning several languages at home [ REF ] . In order to expand previous research on language motivation , the present study focuses on upper secondary students ’ academic language learning in Switzerland , a historically multilingual country . This context provides a unique opportunity to understand how students ’ prior linguistic knowledge ( e.g. , growing up with more than one home language ) may be related to their motivation to learn several languages . To explore the longitudinal relationship between students ’ motivation for several languages in more depth , this study draws on the concept of value beliefs , which refer to the value students attribute to doing a certain task or activity [ REF ] and are particularly important for predicting students ’ language learning motivation [ REF ] . First , we investigate the longitudinal relations between Swiss German students ’ value beliefs in English ( a foreign language ) , French ( a foreign but national language ) , and German ( the native language , as data were obtained in German - speaking Switzerland ) from Grades 9 to 11 . Second , we explore potential relations between students ’ development of value beliefs in the three language subjects and their linguistic background ( monolingual vs. multilingual ) . Understanding students ’ motivation for learning new languages has been a concern of teachers and researchers in psychology and applied linguistics for more than five decades [ REF ] . The most common motivation models used are the socioeducational model [ REF ] , self - determination theory [ REF ] , the second language ( L2 ) motivational self - system [ REF ] , and expectancy - value theory [ REF ] . These models have distinct characteristics in describing language motivation but they all share some commonalities , in that they usually differentiate between motivational beliefs arising from within individuals or being influenced from outside ( e.g. , by parents ) . For instance , EVT posits that students ’ value beliefs ( beliefs about the value of engaging in a task ) can predict how they will learn [ REF ] . Some of these value beliefs , such as the intrinsic value ( pertaining to personal interest or enjoyment ) or the attainment value ( pertaining to the personal importance of doing well ) , share some intrinsic aspects , which are generally argued to be particularly important in language learning [ REF ] . If students see the value in an activity , they are more likely to engage in learning and to use effective learning strategies [ REF ] . L2 studies that have included EVT -",3.1629814458377212,0.7685796071512123,0.46953822786538146,0.052564156763188666,0.8226101468591129,0.817229364067316,0.03577235772357724,0.11544715447154472,0.1073170731707317,0.00975609756097561,0.22764227642276422,0.09268292682926829,0.06016260162601626,0.04715447154471545,0.16747967479674797,0.030894308943089432,0.03902439024390244,0.016260162601626018,0.024390243902439025,0.024390243902439025,True,211.0,0.8113821138211382,4.826016260162602,615.0,0.02847571189279732,0.02847571189279732,0.02847571189279732,0.0,0.02233389168062535,0.03126744835287549,0.02512562814070352,0.0016260162601626016,32.349436127744525,15.66180638722555,15.760457277294734,18.15928143712575,19.31768463073852,16.632574850299395,69.1506986027944,11.5,14.730320089416217,2496299.740034299,4059.0239675354455,5.696606786427146,5.0,3.0379779201612176,27.833333333333332,27.0,11.206396982676159,1.7285429141716566,1.0,1.0060513872894152,501,225,0.4491017964071856,2968,18,1
"The diversity of worldviews and knowledge systems held about nature by distinct communities was highlighted by a recent report on values assessment for policymakers , the Intergovernmental Science - Policy Platform on Biodiversity and Ecosystem Services report [ REF ] . One approach for exploring variation in knowledge systems is through the lens of language — and in particular by exploring similarities and differences in the ways in which landscapes and their elements are conceptualized through language . Studies of indigenous languages have found differences in conceptualization which can have profound consequences for human – environment relations . These differences often have implications for land cover and land use classes [ REF ] and their definitions in management . For example , experts erroneously relabeled secondary rainforest as primary assuming rainforest had not previously been cultivated [ REF ] , and classified areas used for grazing as unproductive which led to the planting of forest on what was , in fact , grazing land [ REF ] . In both cases , differences in terminology relating to landscape — that did not take into consideration indigenous classifications — affected management decisions , with implications for traditional land use . The resulting importance of capturing multiple conceptualizations of our relationship with landscapes for environmental governance has recently gained traction in policy [ REF ] . Despite this , policy and management approaches often appear to take conceptual equivalence for granted . For example , the European Landscape Convention ( Council of Europe , 2000)—which commits signatories to protecting , monitoring , and managing landscapes of all types — has two official languages , English and French , and is then translated into 41 additional languages . It ostensibly assumes straightforward equivalence between languages . However , a closer examination of the term “ landscape ” and presumed translation equivalents in seven European languages found the superordinate concept landscape may not be so similar across languages after all [ REF ] . Similarly , other international policy initiatives , such as the UN ’s Sustainable Development Goals [ REF ] , are based around targets and indicators . For example , indicator 15.1.1 aims to measure “ Forest area as a proportion of total land area ” although in a diverse sample of languages , linguistic terms related to “ forest ” vary considerably , suggesting that there is no unitary underlying concept ( Burenhult et al . , 2017 ; Burenhult , this issue ) . These differences may be one reason why more formal definitions of “ forest”—for instance , based on tree cover and tree height — vary with profound consequences for measurements at global scales [ REF ] . Related to these issues is a privileging of the English language , and the concepts captured therein , as a dominant language in both science and policy across many countries [ REF ] , especially as the importance of global initiatives increases . This raises a series of important challenges for future work in this area . While previous research has highlighted cross - linguistic differences in isolated concepts , such as “ landscape ” or “ forest , ” it remains unclear whether a more systematic exploration of an entire semantic field would also yield such mismatches across languages . It could be the case that researchers have focused specifically on terms which are vague or ill - defined but these are , in fact , the minority when considering the larger vocabulary in this domain . For example , superordinate concepts , such as landscape , are in any case more abstract , and , therefore , potentially less likely to be comparable across languages [ REF ] . Moreover , studies reporting substantive differences across languages have often focused on case studies based around introspection and dictionary definitions [ REF ] , whereas quantitative corpus - based studies are divided over whether semantic domains related to the physical world ( such as landscape ) show substantive similarities across languages [ REF ] . This highlights the need for further empirical study using speaker judgments to clarify the matter . In this paper , we , therefore , examine multiple terms within a single semantic field related to “ waterbodies ” in two related languages , English and German , with both lay people and experts . Specifically , we explore how speakers mentally represent the domain of “ waterbody ” terms through sensory , motor , and emotion associations . In doing so , we assume this provides insight into the meaning of these terms , although we remain agnostic for present purposes as to whether the concepts themselves are stored in neural systems for perception and action [ REF ] or amodal brain regions [ REF ] . To illustrate ,",3.216616541160218,1.2730575748450068,0.4938365575381232,0.07563199938359541,0.8467066946129004,0.8391631815744482,0.03598014888337469,0.08933002481389578,0.1315136476426799,0.009925558312655087,0.24441687344913152,0.09057071960297766,0.05459057071960298,0.04838709677419355,0.16377171215880892,0.03722084367245657,0.011166253101736972,0.018610421836228287,0.02977667493796526,0.034739454094292806,True,293.0,0.8300248138957816,5.023573200992556,806.0,0.010712814173877214,0.010712814173877214,0.0,0.0,0.01442109600329625,0.02018953440461475,0.014833127317676144,0.007444168734491315,35.656264285714315,14.963735714285715,15.487659770458691,17.716285714285714,19.449955357142855,17.35505952380952,67.05857142857143,10.8,20.182510189456128,582308066.453255,722466.5836889021,5.825892857142857,5.0,3.2123805944748365,26.88,29.0,11.618330344761247,1.7008928571428572,1.0,0.9946878730088572,672,341,0.5074404761904762,4049,25,2
"Bosnian / Croatian / Montenegrin / Serbian ( BCMS ) is one of the most widespread heritage languages1 in Switzerland . At least 2.4 % of the Swiss population speaks BCMS on a daily basis , which corresponds to 173,546 individuals.2 However , the BCMS spoken in Switzerland is still under - investigated , despite the increasing body of research on heritage languages [ REF ] and on heritage BCMS spoken in other German - speaking countries [ REF ] . One of the main challenges in the research on heritage varieties is the difficulty in obtaining and redistributing authentic data , which often limits the research settings to case studies based on online communication between peers [ REF ] . What is particularly lacking for facilitating the research on ( BCMS ) heritage varieties are corpora of spoken language , since heritage speakers use their heritage language predominantly in oral communication . In order to provide a resource which would enhance the study of heritage BCMS , we created a map task corpus of this variety spoken by second - generation speakers in Switzerland . The corpus consists of data that have been collected by students during the courses “ Corpus linguistics ” and “ BCMS as heritage language in Switzerland ” at the Department of Slavonic Languages and Literatures at the University of Zurich in 2019 and 2020 . The aim of the exercises was to train the students to conduct an empirical study on spoken language . The task included fieldwork , transcription of speech , linguistic annotation and analysis of selected phenomena found in the collected data . At the end of the courses , we obtained 30 short transcripts and recordings of BCMS heritage speakers having parents born in former Yugoslavia . In order to present this data to a broader audience , and to present a prototype for a corpus access of this type of spoken data , we created an interactive platform on which users can preselect the transcripts according to particular metadata and frequency distribution of pre - annotated features , sort and filter corpus counts , search the annotated turn - aligned transcripts , and add and export their own custom annotations . Hence , in addition to providing a first publicly available resource for heritage BCMS in German - speaking diaspora , with this corpus , we also present an example for visualising , structuring , and accessing spoken language data . With the corpus architecture used for this prototype , we address the need of user - group specific differentiation when accessing spoken language corpora [ REF ] . The map task corpus of heritage BCMS is primarily tailored for linguists investigating heritage BCMS in interaction , and teachers and learners of BCMS living abroad . The migration from the countries of former Yugoslavia to Switzerland started in the 1960s , when the name of the official language was Serbo - Croatian . However , Serbo - Croatian as standard language has never been entirely uniform : there was an Eastern and a Western variety , as well as two other ( sub- ) varieties : Bosnian – Herzegovinian standard - language expression and Montenegrin standard - language expression [ REF ] . Following the break - up of Yugoslavia , new standard languages have been codified from what was former known as Serbo - Croatian : Bosnian , Croatian , Serbian and Montenegrin . All these standard languages are almost completely mutually understandable , since they are all based on the Štokavian dialect , which is spoken in all of these countries.3 While the denomination BCMS is widespread in the linguistic community , Bosnian , Serbian , Croatian and Montenegrin are also seen as separate languages , depending on the definition and approach one adopts when dealing with them . There is an extended body of literature about the controversy of BCMS and whether and under which aspects it can be considered one language [ REF ] . For reasons of consistency , in this paper we use the term BCMS to denominate these language(s ) , although the variety from Montenegro is not included in our data .",3.207535305890904,0.8173640343048519,0.472911881107306,0.05108412265736594,0.8545887470245361,0.8468345824409934,0.03566333808844508,0.07845934379457917,0.12981455064194009,0.014265335235378032,0.21968616262482168,0.09985734664764621,0.0898716119828816,0.07275320970042796,0.1326676176890157,0.03138373751783167,0.011412268188302425,0.014265335235378032,0.034236804564907276,0.03138373751783167,True,273.0,0.8530670470756063,4.807417974322396,701.0,0.0,0.0,0.0,0.0,0.008845208845208846,0.010319410319410319,0.011056511056511056,0.007132667617689016,40.496732128829535,15.495162782578337,15.631368783578527,18.731221087544736,19.99583398795496,15.173399668325043,68.22108754473248,11.578947368421053,19.130879618487022,203439580.79377517,290213.38201679767,5.42620232172471,5.0,3.005651394291739,31.736842105263158,27.0,13.415788441287566,1.5854063018242124,1.0,0.8794235027981228,603,266,0.44112769485903813,3370,19,3
"Framing is one of the most popular contemporary theoretical approaches in communication research [ REF ] . Many studies refer to the concept but sometimes fail to provide definitions , resulting in a diversity of phenomena subsumed under this conceptual umbrella [ REF ] . This complicates attempts to synthesize theoretical and empirical insights — which has often been described as a problem for communication research [ REF ] . Systematic reviews aim to help overcome such problems by identifying common trends , locating research gaps , and guiding future research ( e.g. , for framing : Borah , 2011 ; Matthes , 2009 ) . However , the reviews available have not made much use of one of the unique characteristics of the framing approach : its bridging potential [ REF ] . This relates to the fact that framing is able to consider the entire communication process , with all its aspects , and thus bridges different ( interdisciplinary ) perspectives : strategic communication by a variety of actors ( including their cognitions ) ; journalistic cognitions , processing of information , and subsequent reporting ; frames of audiences ; framing effects ; as well as the broader cultural contexts in which frames emerge and compete for attention [ REF ] . Entman ( 1993 ) refers to frame locations in the communication process : the communicator , the text / message , the receiver , and the culture . Here we argue that by systematically reviewing how framing has been applied across frame locations and by elucidating the most salient frames at each location , we gain indications about the cultural framing repository — that is , the ( competitive ) environment of salient and culturally / cognitively available frames [ REF ] . Reviewing the literature and assessing a cultural framing repository is best performed when selecting one specific topic for which many studies are available . Here we focus on the framing of climate change [ REF ] for a number of reasons . ( 1 ) Since climate change is one of the most important contemporary global problems [ REF ] , exploring its communication is highly relevant . Audiences continue to rely on a set of different sources to obtain information about the issue but nevertheless find the topic difficult to engage with and understand ; in this context , frames also affect ( the support for ) actions audiences are willing to undertake [ REF ] . Furthermore , climate change is a special topic due to its unobtrusiveness , complexity , and scientific ( un)certainty [ REF ] , as well as the required connections between experts , policy , sources of information , and audiences for combating it : framing is able to “ break through the communication barriers ” ( e.g. , Nisbet , 2009 , p. 15 ) . Certainly , many scholars also share the normative expectation that studying framing helps develop communication strategies ( for target audiences ) , build consensus , and support actions to fight climate change [ REF ] . To do this effectively , framing needs to be explored across frame locations . ( 2 ) Since research on framing in climate change communication is growing steadily [ REF ] , future research will benefit from a systematic review . Systematic reviews can take stock and guide future research more thoroughly when many studies are published in a",3.1032993921474312,0.982536847295036,0.47548598369676803,0.0758246080191525,0.7268366647117278,0.7215940856840461,0.03298611111111111,0.08506944444444445,0.0954861111111111,0.015625,0.2222222222222222,0.11458333333333333,0.0642361111111111,0.027777777777777776,0.1892361111111111,0.05381944444444445,0.022569444444444444,0.013888888888888888,0.027777777777777776,0.027777777777777776,True,196.0,0.7951388888888888,4.751736111111111,576.0,0.051932367149758456,0.01932367149758454,0.0,0.0,0.018115942028985508,0.025362318840579712,0.021739130434782608,0.005208333333333333,33.79223118279572,14.963709677419356,15.760457277294734,17.903225806451612,18.085505376344088,16.260387096774192,66.26344086021506,10.444444444444445,15.798855404383598,7267009.409207417,12616.335779873987,5.647311827956989,5.0,3.1384398356011314,25.833333333333332,22.0,14.686539566706804,1.735483870967742,1.0,1.0518437638277347,465,239,0.513978494623656,2737,18,4
"Francoprovençal is a non - standardized and highly endangered Gallo - Romance language spoken today by about 110,000 to 160,000 speakers in France , Switzerland , and Italy [ REF ] . It was never the official language of an administrative entity and never saw standardization . Nowadays , all speakers of Francoprovençal are bilingual , and for Swiss varieties , most of them are older than 70 years , with the notable exception of Evolène in the canton Valais in Switzerland where the local variety of Francoprovençal is still transmitted to the next generation [ REF ] . In the Aosta Valley , in Italy , due to successful language policy promoting the use of Francoprovençal , we also still find competent native speakers of all ages . Not only geographically , but also typologically , Francoprovençal can be considered a ‘ bridge ’ between French , Occitan and Italian dialects , but it is relatively underresearched in terms of its morphological or syntactic properties ( but see e.g. , Diémoz 2007 for subject pronouns and subsequent publications ) . Since 2018 , a binational project focusing on so - called ‘ partitive articles ’ ( henceforth PA ) in Francoprovençal varieties and Northern Italian Dialects ( NIDs ) has contributed to a better understanding of the nominal morphosyntax of Francoprovençal varieties . In an important antecedent study to this project , Kristol [ REF ] has already shown a subdivision of French , Swiss and Italian varieties into two types according to their determiner systems : “ Francoprovençal A ” , which comprises the Western varieties of the Valais ( Switzerland ) and the Northern varieties ( in France and Switzerland ) , and “ Francoprovençal B ” , which comprises Southern Francoprovençal , that is , the Southern varieties spoken in France , the Eastern varieties in the Swiss canton of Valais and the Aosta Valley in Italy . Francoprovençal A varieties have a gender distinction on plural definite articles ( masc . lu(z)—fem . le(z ) ) , like in Ibero - Romance systems , and they possess a fully - fledged PA , like French [ REF ] . In contrast to French , however , PAs in Francoprovençal A are also attested after quantifiers / quantity expressions like Fr . beaucoup ‘ a lot ’ and under the scope of sentential negation [ REF ] . Francoprovençal B varieties do not show , like French and unlike Italian , any gender distinction on the plural definite article ( le(z ) , with a sort of liaison consonant [ z ] realized only in front of vocalic onsets of the following word ) ; correlated with this morphology , these varieties only have an obligatory [ REF ] invariable DE for indefinite mass singulars and indefinite plurals ( with an optional allomorph de-[z ] in the plural before vocalic onset ) . In addition , definite articles in some localities of the Francoprovençal B area ( e.g. , eastern Valais , Switzerland ) exhibit the remains of an older subject vs oblique case system when they are singular , as illustrated in Table 1 [ REF ] . In sum , the two main types of Francoprovençal are",3.165733455308805,1.1325219056350257,0.4259375044869253,0.07005404042167948,0.7086900272406638,0.6872411544124285,0.02578268876611418,0.09576427255985268,0.13075506445672191,0.014732965009208104,0.15469613259668508,0.053406998158379376,0.08103130755064457,0.13259668508287292,0.19337016574585636,0.04604051565377532,0.0055248618784530384,0.007366482504604052,0.01841620626151013,0.03683241252302026,True,187.0,0.7937384898710865,4.624309392265193,543.0,0.011791680314444808,0.0,0.0,0.0,0.011464133639043564,0.01604978709466099,0.01473960039305601,0.04419889502762431,45.809433301924884,13.25588908332212,14.803905376888956,16.781208776416747,17.344108224525506,15.408695652173915,60.030825144703186,8.823529411764707,15.295657268289592,4393590.218687723,8091.326369590651,5.503432494279176,5.0,3.4506142627169156,25.705882352941178,26.0,18.842270082676134,1.5949656750572083,1.0,0.8811643593067163,437,223,0.5102974828375286,2511,17,5
